,content
0,오늘 새로 새마을금고 카카오페이 체크카드를 만들었는데요 카카오페이에 계좌연결 하려고 카드 번호랑 전화번호 맞게 했는데 카드사 정보와 일치하지 않다고 뜨네요 어떻게 해야할까요 ㅠㅠ
1,"새마을금고 카카오페이 체크카드 전월실적 기준이 어떤거죠?
출금(계좌이체포함)되는 모든 금액인가요, 아님 사용한것만 인가요???"
2,"새마을금고 통장이 있어야 발급가능한가요?
생활비카드로 쓰려고 하는건데 요즘 통장 만들려면 증빙서류 있어야하잖아요
못만들까요?"
3,"저 새마을금고에서 카카오페이 체크카드 만들었는데
토스에 카드 연결은 안 되나요ㅜㅜ"
4,새마을금고 카카오페이 체크카드 쓰고있는데 카드 만들때 따로 하루? 한도 설정을 안 했었어요. 근데 잔액은 남아있는데 한도 초과라 뜨더라고요. 청소년 체크카드 기본으로 설정되는 한도 같은 게 있나요?
5,"새마을금고 카카오페이 체크카드를 만든지 3개월 째 입니다.
제가 들은 바로는 3개월 후에 출금 가능하다고 해서 출금 해보려고 했더니 할 수 없다고 뜨네요 어떤 분은 한달 동안 20번 긁어야
출금 할 수 있다고 하셨고 새금 카페 체크카드 출금 어떻게 해야되나요???"
6,"카카오페이에 새마을금고 체크카드를 등록하고
매장에서 등록한 체크카드로 결제 가능한가요?

가능하다면 결제하는 방법은 어떻게 되나요?"
7,"현재 새마을금고 카카오페이 체크카드를 가지고 있는데요
이번에 국민은행에서 방탄 체크카드가 나왔다고 해서 만들고 싶은데 만들 수 있나용"
8,"새마을금고 카카오페이 체크카드를 사용하는데요
간편결제하면 할인해준댔는데
그냥 간편결제했더니 할인이 안되서 문의드립니다
무슨 설정해야하나요?? 아니면 캐시백 처럼 들어오는건가요 ..?"
9,"선불 교통카드가 가능하다고했는데 그럼
연결된 계좌 잔액에서 빠져나가는 건가요?"
10,제가 새마을금고 카카오페이 체크카드 사용하고있는데 어느날 캐시백 취소 미출이라고하면서 돈이 출금 되더라고요 왜 돈이 나간지모르겠어요ㅠㅠ 알려주세요 혹시 돈이 더나가나요??
11,제가 새마을금고 카카오페이 체크카드를 쓰는데 내일 국민은행으로 계좌이체를 해야하는데 수수료 얼마 붙을까요?
12,"몇일 전에 새마을금고 카카오페이 체크카드로 온라인결제하면 15% 할인된다고 해서 카카오에 들어가서 새마을금고 체크카드등록후에 티몬에서 결제 했는데 3일정도 지났는데 캐시백?이 안들어오더라고요ㅠㅠ 캐시백은 결제 후 몇일 뒤쯤 들어오나요?
아니면 티몬은 해당이 안되는건가요? ㅠㅠ"
13,안녕하세요 새마을금고에서 카카오페이 체크카드를 발급받을려구하는데용 은행가서 해야돼나요아님 핸드폰으로해야하나요?? 통장만들고 체크카드를 만들려구요 16살입니다 해외결제가되었으면좋겠습니다 아이폰을쓰고있어서요... 이거말구 다른카드추천해주세용!!
14,"만 14세 이상 청소년인데 새마을금고 체크카드 관해서 질문드려요!

1, 새마을금고 체크카드와 새마을금고 카카오페이 체크카드는 서로 다른 것인가요? 다르다면 무엇이 다르나요?

2, 청소년 혼자 가서 발급 받으려고 하는 경우 지참해야 하는 것에는 무엇이 있나요?

3, 통장이 있긴 한데 내역이 끝까지 다 사용한것이라 재발급 받아야 하는데 청소년 혼자 가서 재발급을 받으려는 경우 지참해야한 것에는 무엇이 있나요?"
15,이거 카카오톡에서 카카오페이랑 연결 해서 쓸 수 없나요? ㅠㅠ 계좌연결 하려는데 자꾸 카드사 정보가 다르다고 뜨는데 ..왜이러쥬
16,"새마을금고 카카오페이 카드로 티몬캐시 충전했는데
이거는 실적 포함 안되나요??
자동차세 납부한것도 실적 포함 안됐더라구요"
17,선불 교통카드의 기능이 가능하다고 했는데 그럼 연결된 통장계좌에서 교통을 이용할경우 돈이 빠져나가나여?
18,"새마을금고 카카오페이 체크카드를 만들려고 하는데요
18살인데 만들때 뭐가져가야하나요?? 여권만 들고가면 되나요??"
19,"하나은행 카카오페이 후불교통카드 체크카드 쓰고있는데요, 오늘이 결제일 일주일 전인데(결제일은 매월 1일)
오늘 하나카드에서 카드 사용내역과 교통비 사용내역이 써있는게 우편으로 왔더라구요

이 우편 발송 안 오게 할 순 없나요?"
20,"새마을금고 카카오페이 체크카드를 만들었는데 입금 어떻게 할 수 있나요??
만 14세예요 현재 05입니다
그리고 폰 명의가 부모님인데 제 명의로 바꿔야하나요??"
21,제가 오늘 새마을금고에서 죽은 통장 살리면서 카카오페이 체크카드도 만들었는데 이거 계좌에 돈이 없어도 카드로 결제하면 카카오 페이에서 돈이 나가는 건가요?? 아니면 이거 등록이나 혜택같은거좀 자세히 알려주세요 ㅠㅠ
22,"제가 이번 9월에 위메프에서 에어팟을 구매하려고 했는데


찾아보니 새마을금고 카카오 페이 체크카드 혜택이




전월(8월) 15만원 이상 쓰면 카카오페이 사용처에서 15%할인이 되더라고요(위메프에서 사용가능)


그래서 실적이 충족되어 15% 할인이 될줄  알고 일단 위메프에서 카카오페이 체크카드로 에어팟 16만원짜리를 2개 결재를 하였습니다.(09/15일에 결재)






근데 8월실적을 다시 한번 확인해보니 15만원 이상이 아니였던겁니다 ㅜㅜ


그래서 또 다시 에어팟 320,000 만원을 주문취소 하였는데(09/17에 주문취소)


제 9월 실적에 취소금액이 더해져 9월동안 사용한 카드 실적이 차감되거나 불이익 되지는 않나요? 9월달 실적 쌓아서 10월달에 할인받아 에어팟을 재구매 할려고 합니다..


새마을 금고 홈페이지 설명중
(이전 월 이용내역의 매출취소 발생 시 취소 거래일이 포함된 월의 카드실적에서 차감됩니다.)


라고 적혀있는데 에어팟 취소 금액이 8월달 카드실적에서 차감된다는 말인가요?"
23,"토스에 새마을금 카카오페이 체크카드 등록을 하려고 하는데 새마을금고를 BC로 해야된다고 들었는데요..

계속 사진처럼 지원하지 않는 카드사라고 뜨네요..

혹시 새마을금고 카카오페이 체크카드는 토스에 등록을 할 수 없는건가요?

만약 할수 있다면 계속 지원하지 않는 카드사라고 뜨는데 어떻게 해야할까요ㅠㅠ"
24,새마을금고 카카오페이 체크카드를 발급받았는데 그 노란색에 카카오프렌즈들 뛰다니는거요... 아직 생일이 안 지나서 만 13세이고요 이 카드도 해외결제 신청하면 해외결제 되나요? 된다면 어떻게 해야되죠...
25,"저번달(9월) 체크카드로 총 34,5770원 사용했고요

사진에서 보이다 시피 10/1일 새벽에 위메프에서 카카오

페이 간편결제한후 새마을금고 선택해서 물건을 결제했어요

근데 할인내역에 내역이 없어유 ㅠㅠ"
26,"새마을금고 카카오페이 체크카드

제가 내일 연차를 쓰고 새마을금고에 방문할려고 하는데

용돈으로쓸 카카오페이 체크카드를 하나 만들려고합니다


1.체크카드 만들면 당일날 은행에서 카드를 바로 받을수있나요?

2.제 월급통장도 새마을 금고인데 거기서 그 카드에 매달
40만원씩 자동이체 할려고하는데 가능한가요?
카드만있고 계좌는 없는거아니에요??"
27,"제가 새마을금고 카카오페이 체크카드를 잃어버렸는데 정지신청 하려면 어떡하죠..?
폰이랑 연동도 안해놔서 알림도 안떠요,,,"
28,"카카오페이 하나카드 (체크카드)
를 교통카드로도 이용 가능한가요?
후불말고 편의점에서 충전해 쓰는거요.

자세한 답변 부탁합니다."
29,새마을금고 카카오페이 체크카드인데 어느걸 선택해야되나요?
30,"카카오페이 신한카드 체크 만14세 질문입니다
이 카드가 만14세부터 발급이 되고 교통카드기능도 들어가나요? 내공 80"
31,"새마을금고카카오페이 체크카드를 등록해놓고, 매장에서 직접 카카오페이로 결제했는데 체크카드로 결제된게아니라 예전에 계좌등록해놓은 우리은행계좌에서 바로 출금됐어요. 새마을금고는 계좌는 등록안하고 체크카드만 등록해서 그런가요? 카카오페이에서 체크카드로 결제하려면 어떻게 해야하나요? 새마을금고 체크카드로 카카오페이 결제하면 15%할인해준대서 한번 써보려구요. 내공100점드려요"
32,"일단 9월 30만원 사용해서 통합할인한도 1만원 생겼고요



10/1 위메프에서 카카오간편결제로 158,900원 결제함
10/2 그러나 배송지연으로 당일 오전 결제 취소함

10/2 티몬에서 오후에 다시 카카오 간편 결제 16,3500 다른 상품으로 결제


10/3 158,900결제 캐시백 1만원 입금
10/5 그러나 158,900결제 취소해서 캐시백 1만원 회수해감 ㅠㅠ




회수해간 캐시백 ㅠㅠ 언제 다시 들어오나요?

캐시백 회수 해가도 10/2일에 163,500원 결제건으로 캐시백 1만원 들어와야 하는게 정상 아닌가요???

안들어 오네요 ㅠㅠ




사진도 첨부 합니다!"
33,제가 카카오페이 체크카드 새마을금고 발급받을려고 하는데 새마을금고만 없어서 어떻게하나요..??
34,"1.MG 새마을금고 카카오 체크카드는 사용시 새마을금고 내 연결된 계좌에서 돈이 지불되는 형식인가요?

2.카카오페이 체크카드는 사용시 카카오톡 페이머니 라는 곳에 돈이 있어야 쓸수 있나요? 아니면 페이머니에 돈이 없어도 연결된 계좌에서 돈이 지불되나요?(참고로 연결계좌는 MG 새마을금고 카카오 체크카드와 동일한 계좌입니다.)

3.카카오페이로 결제 한다는 말이 뭔가요? 카카오톡 어플에 있는 페이머니란에 결제라는 버튼이 있던데 그걸로 결제 하는건가요? 아니면 카카오페이 체크카드로 결제해도 카카오페이 결제가 되는건가요(카카오페이 결제시 가맹점에서 15프로 할인을 받고 싶습니다.)"
35,"이카드 내역볼려면 어디들어가야하나요?
bc카드들어가니깐 체크카드 보유해야 회원가입이 된다고하고 안되던데..

구글페이먼트 코리아에서 자동이체가 됬는데
어떤아이디로된건지 몰라서
어디로 전화해야되나요? 
혹은 인터넷으로 취소가능한가요?"
36,"새마을금고 카카오페이 체크카드 사용하고 있는데

이게 전월 실적 15만원 이상인데 휴대폰 요금을 이 체크카드로 자동이체 하게 되면 그 요금도 전월 실적에 포함이 되는건가요??"
37,"제가 새마을금고 카카오페이 체크카드를 카카오페이에 등록했는데요.
그럼 카드를 사용하면 카카오페이에서 돈이 빠져나가나요 아님 새마을금고에서 돈이 빠져나가나요?"
38,새마을금고 카카오페이 체크카드를 사용중인데 카카오페이 15%할인이 오프라인도 된다는 답변을 받았는데요. 카카오페이 제휴매장에 가서 카카오페이로 결제한다고한고 실물카드로 결제하면 되는겅가요??
39,"평소에 MG카드를 쓰고 있었는데, 카카오뱅크로 주로 쓰게 되었습니다. MG카드에는 혜택이 많아서 인터넷에서 결제를 할때마다 카카오뱅크에 있는 돈을 MG카드에 옮겨썼는데 요즘 이상하게 혜택할인이 안됩니다."
40,계좌확인 분명히 눌러서 확인되었습니다 라고 떴는데 마지막에 신청할라그러면 계속 이렇게 뜨는데 뭐가 잘못된건가요?ㅠㅠ 인터넷으로 해도 자꾸 계좌번호를 확인하라고 뜨네요ㅠㅠ
41,새마을금고 카카오페이 체크카드를 카카오페이 등록하다가 비밀번호 앞자리 2개 누르는걸3번 잘못눌러서 오류횟수 초과가 됫는데 어느카드사로 전화해야하나요? Bc카드에 전화하니까 등록 되지않은 카드라고 나오네요..
42,"제가 새마을금고 카카오페이 체크카드를 발급 받았는데요. 이 카드랑 카카오톡에서 신청하는 페이카드는 다른건가요?

+ 같은계좌에서 페이카드를 쓰고싶으면 새마을금고 카카오페이 체크카드를 중지하고 신청하면 되나요?"
43,새마을금고 은행에서 카카오페이 카드로 출금하면 수수료 드나요 ?
44,KB국민 카드 체크카드로 카카오페이 농협 전용 계좌로 발급을 받았는데 카카오 페이 카드 잔액 조회하는 방법좀요
45,"만14세이상 청소년인데 통장도새로계설 할려고요
이번년도부터 만14세이상은 청소년증, 초본들고가면 혼자서 체크카드 만들 수 있다더라고요 통장도 같이 만들거라 그런데 도장도 같이 들고가면 될까요 카카오페이는 상관없나요 내공100이요"
46,제가 새마을금고 카카오페이체크카드를 인터넷신청으로 발급받고 카드사용을 하려면 새마을금고 계좌가 있어야 하는건가요???농협계좌가 한개 있긴한데 그 계좌에 카드를 두개 사용 안되지않나요??
47,"만 14세 이상 미상년자이고 부모님이 새마을금고 카카오페이 체크카드로 만들어 오셨는데 폰으로 연결이 되는지 궁금합니다. (참고로 제가 사용하는 폰은 부모님 명의입니다)

1)검색해보니 토스에 새마을금고 계좌는 연결이 가능하다던대 되는지 여부와 된다면 연결 방법이 궁급합니다

2)카카오페이는 본인 명의가 아니여도 카드 연결이 가능한지 가능 여부와 만약 된다면 방법이 궁금합니다

3)그 외에 새마을금고 카카오페이 체크카드를 토스 카카오페이와 같은 앱 연결이 가능한지(본인 명의 폰이 아니더라도) 된다면 어떤 앱이 있는지 궁금합니다"
48,저 위에 할인혜택은 밑에 사진처럼 전원실적금액이 되야지 받을 수 잇는 혜택이에요 ?
49,"새마을 금고 카카오페이 체크카드 한도가 만 14세 미만은 하루 3만원이라고 하던데 지금 만들고 만 14세 이상이 되면 그 한도를 깰수있나요?? 아니면 다시 만들어야 하나요?? 그리고 그 체크카드를 청소년이 만들라면 어떻게 해야하는지 뭘 가져가야하는지도ㅠ알려주세요 참고로 올해 15세지만 생일이 지나지않아 만 13세, 즉 만 14세 미만 입니다!"
50,"안녕하세요
새마을금고 카카오페이 체크카드 발급사 BC 맞나요?"
51,이 카드를 신청하면 카카오페이에 연동해서 오프라인매장에 결제하면 카카오페이 금액에서 차감되나요?
52,"어제 새마을금고가서 통장이랑 체크카드 만들었는데 원래 부모님 체크카드 썼어서 후불이였는데 미성년자라 선불교통카드인데 뭐가뭔지 ..

카카오페이가 뭐할때 쓰는거에요?
카카오페이랑 연동해야하나요?
혜택은 뭐뭐가 있어요?
선불교통카드는 계좌에서 빠지는게 아니라 따로 충전해야된다던데 어떻게하는거에요?"
53,"새마을금고 카카오페이 체크카드 오늘 만들었는데 인터넷 뱅킹을 신청해야 새마을금고 어플로 입출금 가능한거죠?
그냥 은행가서 신분증만 인터넷뱅킹 신청하면 되는거죠??"
54,새마을금고 카카오페이 체크카드 일일한도가 있나요??체크카드도 한도가 있다는말을 들러본적이 없어서.. 청소년이구요 오늘 발급받았어요 일일한도가 있다면 얼마인가요??
55,카카오페이 체크카드 선불교통기능 있는데 티머니 충전은 어디서 해야하나요?
56,새마을금고 카카오페이 체크카드 돈 잔액을 확인하고 싶은데 핸드폰 어플을 깔아서 확인할 수 있나요? 제가 공인인증서는 농협이라 뭔가 안될거같기도 하고ㅠㅠㅠㅠㅠ
57,새마을금고 카카오페이 체크카드를 잃어버려서 말씀드립니다. 재발급 받으러 가야할때 무엇이 필요하고 뭘 하면 재발급을 받을수 있나요(??
58,새마을금고 카카오페이 체크카드 할인받은 매출은  실적으로 인정이 안되나요?
59,"새마을금고 카카오페이 카드 가지고 있는데요

카드 만들기만 했는데 토스로 바로 송금 가능한가요?"
60,안녕하세요 제가 카카오페이 새마을금고 체크카드를만들었는데 다른지인들이 이카드혜택이있다는데 어디어디서 혜택을받을수있죠?
61,"제가 새마을금고 카카오페이 체크카드를 만들었어요
교통카드기능을 말을 안했어요
다시 가서 만들어야 할까요 ??"
62,새마을금고 카카오페이 체크카드는 영화할인 2천원이 된다고 해서 발급했는데 8천원이 정가인데 8천원그대로 결제가 됬어요 나중에 입금 되는 형식인가요? 입금되는 기간은 얼마나되나여?
63,"새마을금고 카카오페이 체크카드를 발급했는데
발급할 때 티머니 사용 신청을 깜빡했으면 다시 재발급하러 가야 하나요..? ㅠㅠㅜ"
64,"새마을금고 체크카드로 카카오페이결제하는법이요
카카오톡에 더보기로 들어가면 잇다는데
아무리찾아도 안보여요 자세히 설명해주실수있으신분계신가요...??
안드로이드폰 입니다ㅜ
핸폰결제말고 매장에서 카카오페이(새마을체크카드)로 결제하는 방법 알려주세요 내공걸어요"
65,제가 새마을금고 카카오페이 체크카드를 쓰는데 가게에서 계산을 하려니까 잔고는 남았는데 한도 초과라고 하더라고요... 뭘까요ㅠㅠㅠ
66,"저번 9월달에 30만원  넘게 결제해서 실적은 충족 됬고용 (카드사에 전화해서 확인해봄)


새마을금고 카카오페이 체크카드 혜택중에


카카오페이 간편결제를 통해 새마을금고 체크카드로 결제 하면 15% 할인 혜택을 받을수 있잖아용


그러면 예를들어서


제가 소셜커머스에서 카카오간편결제로 15만원짜리 물건을 사면 15만원의 15%금액인

22.500원이 할인되어 계좌에 캐시백으로 입금 되는건가용?


아니면 30만원 실적 충족한 통합한도 금액인 1만원이 입금 되는건가용?


정말 잘 아시는 분만 답변주세요 ^_^"
67,"새마을금고 카카오페이 체크카드를 데이트 통장으로 쓰고있는데요
카드는 올해 2월 8일에 발급 받아서 그 날부터 2월 28일까지 카드 사용 금액이 거의 50만원 정도 되는데
카드 실물은 제가 갖고있고 남자친구가 삼성페이에 등록해놔서 거의 대부분을 삼성페이로 계산을 했어요

근데 카드 처음 발급받을 때 첫 한두달은 사용 실적이 없어도 5000원 캐시백이 들어온다고 했던 것 같은데 아직까지 소식이 없네요ㅠ

혹시 영화 예매나 온라인 쇼핑 등등 모든 캐시백 들어오는 날짜가 정해져있나요???
혹시 삼성페이로 결제해서 실적이 안 쌓인걸까요???
그럼 앞으로는 실물 카드로 계산해야하나요???

이상한 답변 및 광고 글은 신고합니다!"
